Symbol,Name,Last Sale,Net Change,% Change,Market Cap,Country,IPO Year,Volume,Sector,Industry
XNET,Xunlei Limited American Depositary Shares,$2.38,-0.10,-4.032%,159439998.00,China,2014,324942,Technology,Computer Software: Prepackaged Software
XPER,Xperi Holding Corporation Common Stock,$19.87,-0.13,-0.65%,2077017896.00,United States,,434748,Technology,Semiconductors
XRX,Xerox Holdings Corporation Common Stock,$21.06,-0.08,-0.378%,3759463899.00,United States,,1920114,Technology,EDP Services
YNDX,Yandex N.V. Class A Ordinary Shares,$65.65,-1.39,-2.073%,22982385673.00,Netherlands,2011,1735106,Technology,Internet and Information Services
YY,JOYY Inc. American Depositary Shares,$49.59,0.23,0.466%,3865931071.00,China,2012,760364,Technology,EDP Services
ZBRA,Zebra Technologies Corporation Class A Common Stock,$597.74,-7.65,-1.264%,31944116830.00,United States,1991,203213,Technology,Computer peripheral equipment
ZD,Ziff Davis Inc. Common Stock,$108.54,-6.04,-5.271%,5233884655.00,United States,,296962,Technology,Advertising
ZI,ZoomInfo Technologies Inc Class A Common Stock,$62.91,-3.04,-4.61%,25366367881.00,United States,2020,3387437,Technology,Computer Software: Prepackaged Software
ZIXI,Zix Corporation Common Stock,$8.49,0.00,0.00%,482151073.00,United States,,568379,Technology,Retail: Computer Software & Peripheral Equipment
ZM,Zoom Video Communications Inc. Class A Common Stock,$188.27,-6.59,-3.382%,56103437317.00,United States,2019,3794958,Technology,Computer Software: Prepackaged Software
ZNGA,Zynga Inc. Class A Common Stock,$6.34,-0.19,-2.91%,7101950647.00,United States,2011,20498169,Technology,EDP Services
ZS,Zscaler Inc. Common Stock,$303.04,-8.77,-2.813%,42441611118.00,United States,2018,3579133,Technology,EDP Services
